{
  "projection_schema": "1.0",
  "machinery_version": "v0.11.1",
  "design_id": "sha256:3e61bcd868505303d65a3a89a7cefdf11a7bcbb90c34b5ba4ac6c542ddf3fe90",
  "checker_id": "pii-flow",
  "manifest_hash": "sha256:9675bf9b76b2d02fa375d96f0c7f206b0b3efeb5283b322beaffc56b31c65eeb",
  "include": [
    "model",
    "invariants",
    "relationships"
  ],
  "model": {
    "entities": [
      {
        "stable_id": "entity:AnalyticsExport",
        "name": "AnalyticsExport",
        "attributes": [
          {
            "stable_id": "attr:AnalyticsExport.destination",
            "name": "destination",
            "type": "string"
          }
        ]
      },
      {
        "stable_id": "entity:DataSubject",
        "name": "DataSubject",
        "status_enum": [
          "Active",
          "Erased"
        ],
        "attributes": [
          {
            "stable_id": "attr:DataSubject.email",
            "name": "email",
            "type": "string"
          },
          {
            "stable_id": "attr:DataSubject.nationalId",
            "name": "nationalId",
            "type": "string"
          },
          {
            "stable_id": "attr:DataSubject.status",
            "name": "status",
            "type": "SubjectStatus"
          }
        ]
      },
      {
        "stable_id": "entity:ProcessingActivity",
        "name": "ProcessingActivity",
        "attributes": [
          {
            "stable_id": "attr:ProcessingActivity.purpose",
            "name": "purpose",
            "type": "string"
          }
        ]
      },
      {
        "stable_id": "entity:Redactor",
        "name": "Redactor",
        "attributes": [
          {
            "stable_id": "attr:Redactor.method",
            "name": "method",
            "type": "string"
          }
        ]
      }
    ],
    "invariants": [
      {
        "stable_id": "inv:priv-consent-required",
        "id": "priv-consent-required",
        "text": "Personal data is processed only with recorded consent.",
        "owner": {
          "kind": "entity",
          "entity": "entity:DataSubject"
        }
      },
      {
        "stable_id": "inv:priv-export-idempotent",
        "id": "priv-export-idempotent",
        "text": "A stable export id has at most one effect at the analytics destination.",
        "owner": {
          "kind": "entity",
          "entity": "entity:AnalyticsExport"
        }
      },
      {
        "stable_id": "inv:priv-minimal-collection",
        "id": "priv-minimal-collection",
        "text": "Only attributes necessary for the stated purpose are collected.",
        "owner": {
          "kind": "entity",
          "entity": "entity:DataSubject"
        }
      },
      {
        "stable_id": "inv:priv-no-unredacted-export",
        "id": "priv-no-unredacted-export",
        "text": "No sensitive attribute reaches an export sink without passing through redaction.",
        "owner": {
          "kind": "top"
        }
      },
      {
        "stable_id": "inv:priv-purpose-present",
        "id": "priv-purpose-present",
        "text": "Every `ProcessingActivity` has a non-empty stated purpose before subject data is read.",
        "owner": {
          "kind": "entity",
          "entity": "entity:ProcessingActivity"
        }
      },
      {
        "stable_id": "inv:priv-redaction-effective",
        "id": "priv-redaction-effective",
        "text": "A `Redactor` output contains neither email nor national identifier data.",
        "owner": {
          "kind": "entity",
          "entity": "entity:Redactor"
        }
      },
      {
        "stable_id": "inv:subject-erased-terminal",
        "id": "subject-erased-terminal",
        "text": "A `DataSubject` in Erased accepts no further lifecycle actions and is never processed again; erasure is terminal.",
        "owner": {
          "kind": "entity",
          "entity": "entity:DataSubject"
        }
      }
    ],
    "relationships": [
      {
        "stable_id": "rel:DataSubject->ProcessingActivity:1:n",
        "from": "entity:DataSubject",
        "to": "entity:ProcessingActivity",
        "cardinality": "1:n"
      },
      {
        "stable_id": "rel:ProcessingActivity->Redactor:1:1",
        "from": "entity:ProcessingActivity",
        "to": "entity:Redactor",
        "cardinality": "1:1"
      },
      {
        "stable_id": "rel:Redactor->AnalyticsExport:1:1",
        "from": "entity:Redactor",
        "to": "entity:AnalyticsExport",
        "cardinality": "1:1"
      }
    ]
  },
  "generated": {
    "input_hash": "sha256:06da2492ce48807bc9f38eaae97a48f81cce47e7f92eb7fbc4367901462fc992"
  }
}
